,,MATERIAL_ID,CATEGORY,position,,,,color_way
0,0.0,9.0,zipper,CENTER FRONT,#5 VISLON,YKK ZA/DAG SNAP ON // 2-WAY SEPERATING AUTO LOCK ,1,PSEUDO ANTI SILVER SLIDER  AND DTM TEETH / DTM TAPE
1,1.0,10.0,zipper,UNDERARMS,#5 COIL,DADHR DIECAST WIRE (NON YKK) AUTO LOCK (ZIP UP TO CLOSE) ,1 PER SIDE = 2,PSEUDO ANTI SILVER SLIDER  AND DTM TEETH / DTM TAPE
2,2.0,11.0,zipper,SIDE ENTRY HAND POCKETS,#5 COIL,DADHR DIECAST WIRE (NON YKK) AUTO LOCK ,1 PER SIDE = 2,PSEUDO ANTI SILVER SLIDER  AND DTM TEETH / DTM TAPE
3,3.0,12.0,zipper,INSIDE POCKET,#5 COIL,DADHR DIECAST WIRE (NON YKK) AUTO LOCK ,1,PSEUDO ANTI SILVER SLIDER  AND DTM TEETH / BLACK TAPE
4,4.0,15.0,other,CENTER FRONT,L1 SNAP ON METAL ZIPPER PULL,LUKS / L1-2016-TRIM-009 ,1,PSEUDO ANTI SILVER 
5,5.0,16.0,other,UNDERARMS, SELF FABRIC PULL,FACTORY MADE // 11NT-045 ,1 PER SIDE = 2,SHELL FABRIC MATCHING
6,6.0,17.0,other,SIDE ENTRY HAND POCKETS, SELF FABRIC PULL,FACTORY MADE // 11NT-045 ,1 PER SIDE = 2,SHELL FABRIC MATCHING
7,7.0,18.0,other,INSIDE POCKET, SELF FABRIC PULL,FACTORY MADE // 11NT-045 ,1,SHELL FABRIC MATCHING
8,8.0,21.0,other,FRONT LEFT SLEEVE,L1 SMALL EMBROIDERY,SOLUNA / L1-2016-026,1,DTM
9,9.0,23.0,other,FRONT PLACKET AND POCKET FLAPS,L1 SNAP,LUKS / L1-2016-TRIM-001,8,PSEUDO ANTI SILVER
10,10.0,24.0,other,RIGHT HAND POCKET,L1 NEW PATCH,LUKS / NEW TRIM ,1,TBD
11,11.0,27.0,other,CF POWDER SKIRT CLOSURE,14 MM PLASTIC SNAP,DURAFLEX / 1414,"4 MALE, 2 FEMALE",BLACK
12,12.0,28.0,other,POW SKIRT: JACKET TO PANT CONNECTION ON POWDERSKIRT HEM,14 MM PLASTIC SNAP,DURAFLEX / 1414,3 SETS,BLACK
13,13.0,29.0,other,"""SNAP AWAY POWDER SKIRT"" SNAP POWDER SKIRT TO FRONT FACING WHEN NOT IN USE",14 MM PLASTIC SNAP,DURAFLEX / 1414,"1 MALE, 1 FEMALE",BLACK
14,14.0,32.0,other,BACK HOOD CORD LOCK,CORD LOCK,KNK / SP-177,1 PER SIDE = 2,TBD
15,15.0,33.0,other,BACK HOOD CORD LOCK TIP,CORD TIP,KNK / CS-074,1 PER SIDE = 2,TBD
16,16.0,34.0,other,FRONT HOOD CORD LOCKS,CORD LOCK,KNK / SP-204,1 PER SIDE = 2,TBD
17,17.0,35.0,other,HEM CORD LOCKS,CORD LOCK,KNK /  SP-058,1 PER SIDE = 2,TBD
18,18.0,36.0,other,POCKET CORD TIP,CORD LOCK,KNK / CS-1,1 PER SIDE = 2,TBD
19,19.0,39.0,other,BACK HOOD CORD EXIT,GROMMET 11.5 mm (large),PLEASE SORCE,1 PER SIDE = 2,PSEUDO ANTI SILVER 
20,20.0,40.0,other,FRONT HOOD ADJUST CORD EXIT,GROMMET  8mm diameter,PLEASE SORCE,2 PER SIDE = 4,PSEUDO ANTI SILVER 
21,21.0,41.0,other,HEM ADJUST CORD EXIT,GROMMET  8mm diameter,PLEASE SORCE,2 PER SIDE = 4,PSEUDO ANTI SILVER 
22,22.0,42.0,other,HEM ADJUST CORD EXIT IN LINING POCKET,GROMMET  8mm diameter,PLEASE SORCE,1 PER SIDE = 2,PSEUDO ANTI SILVER 
23,23.0,45.0,other,HOOD & HEM,3mm STRETCH SHOCKCORD,SUPPLER / REF NUBER,,
24,24.0,48.0,other,KEYCLIP LOOP RIGHT HAND POCKET,"1/4"" FLAT X 1 3/4"" LOOP",SUPPLER / REF NUBER,1,BLACK
25,25.0,49.0,other,HEM & HOOD CORD LOCK TIE DOWNS,"1/4"" FLAT WEBBING LOOP",SUPPLER / REF NUBER,5,BLACK
26,26.0,50.0,other,RIGHT HAND POCKET,PLASTIC KEYCLIP ,SUPPLER / REF NUBER,1,BLACK
27,27.0,51.0,other,JACKET TO PANT CONNECTION CENTER BACK ,"3/4"" X 1"" FINISHED ",SUPPLER / REF NUBER,TAB BEHIND EACH SNAP = 2,BLACK
28,28.0,52.0,other,JACKET TO PANT CONNECTION AT SIDE TABS,"3/4"" X 3 1/4"" FLAT WEBBING",SUPPLER / REF NUBER,1,BLACK
29,29.0,55.0,other,POWDER SKIRT GRIPPER ELASTIC,25mm,SUPPLER / REF NUBER,1,STOCK
30,30.0,56.0,other,GOGGLE POCKET,ELASTINE BINDING,SUPPLER / REF NUBER,1,BLACK
31,31.0,57.0,other,LINING MEDIA POCKET CABLE GUIDE,"1/4"" FLAT ELASTIC",SUPPLER / REF NUBER,1,BLACK
32,32.0,58.0,other,ENCASED IN BACK OF SLEEVE HEM,,SUPPLER / REF NUBER,1,BLACK
33,33.0,59.0,other,JACKET TO PANT CONNECTION CENTER BACK TAB,"FLAT ELASTIC TAPE 3/4"" x 4 1/4""",SUPPLER / REF NUBER,1,BLACK
34,34.0,62.0,other,CUFF ,2.5cm X 9cm,PAIHO / Loop#1057,1 LOOP TAB,MATCHING
35,35.0,63.0,other,CUFF TAB,2.5cm X 6.5cm,PAIHO / HookETN7,1 HOOK TAB,MATCHING
36,36.0,64.0,other,CF PLACKET,1.3 cm X 7.5cm,PAIHO / HookETN7 / Loop#1057,4 SETS,MATCHING
37,37.0,65.0,other,HAND & CHEST POCKET FLAPS,1.3 cm X 4cm,PAIHO / HookETN7 / Loop#1057,2 SETS  PER POCKET FLAP,MATCHING
38,38.0,69.0,other,TOPSTITCH,,,,MATCHING
39,39.0,70.0,other,BARTACKS,,,,MATCHING
40,40.0,71.0,other,SLEEVE GAITER COVER STITCH,,,,MATCHING
41,41.0,74.0,other,LEFT HAND POCKET ZIPPER HEAD,L1 HANG TAG,,1,L1 HANG TAG
42,42.0,75.0,label,LINING CB FACING,WP BREATH / SIZE LABEL / RN CA / MADE IN ___,,1,
43,43.0,76.0,label,LINING LEFT SIDE SEAM,ADDRESS LABEL,SEW AS LOOP,1,ADDRESS LABEL
44,44.0,77.0,label,LINING LEFT SIDE SEAM,CONTENT LABEL,SEW AS LOOP,1,CONTENT LABEL
45,45.0,78.0,label,LINING LEFT SIDE SEAM,WASHING LABEL,SEW AS LOOP,1,WASHING LABEL
46,46.0,79.0,other,FRONT LEFT BELT LOOP TO ATTACH HANG TAGS,CLEAR ZIP TIE,SUPPLIER // ,1,CLEAR ZIP TIE
