,,MATERIAL_ID,CATEGORY,,,position,,color_way,color_way,color_way,color_way
0,0.0,6.0,insulation,INSULATION:,,60G PINNECO MANTLE INSULATION ALL OVER,,,TARGET FOB:,,0
1,1.0,9.0,other, #5 METAL ZIPPER,YKK / 2-WAY SEMI AUTO LOCKING WITH 2 L1 CUSTOM PULLS,CENTER FRONT,1,SILDER/PULL/ TEETH COLOR: X ANTIQUE COPPER/ ZIPPER TAPE COLOR: BLACK,SILDER/PULL/ TEETH COLOR: X ANTIQUE COPPER/ ZIPPER TAPE COLOR: BLACK,SILDER/PULL/ TEETH COLOR:H6 ANTIQUE SILVER/ ZIPPER TAPE COLOR: BLACK,SILDER/PULL/ TEETH COLOR: X ANTIQUE COPPER/ ZIPPER TAPE COLOR: BLACK
2,2.0,10.0,zipper, #5 METAL ZIPPER,NON YKK / 1-WAY DADHR DIE CAST WIRE NON LOCKING,RIGHT CHEST POCKET VERTICAL,1,SILDER/PULL/ TEETH COLOR: X ANTIQUE COPPER/ ZIPPER TAPE COLOR: 19-4010 TCX INK,SILDER/PULL/ TEETH COLOR: X ANTIQUE COPPER/ ZIPPER TAPE COLOR: 19-0515 TCX MILITARY,SILDER/PULL/ TEETH COLOR:H6 ANTIQUE SILVER/ ZIPPER TAPE COLOR: 19-1540 TCX RUST,SILDER/PULL/ TEETH COLOR: X ANTIQUE COPPER/ ZIPPER TAPE COLOR: 19-4006 TCX BLACK
3,3.0,11.0,zipper, #5 COIL ZIPPER,NON YKK / 1-WAY DADHR DIE CAST WIRE NON LOCKING,UNDERARM VENTS,1 PER SIDE = 2,SILDER/PULL COLOR: X ANTIQUE COPPER/ ZIPPER TAPE/ TEETH COLOR: BLACK,SILDER/PULL COLOR: X ANTIQUE COPPER/ ZIPPER TAPE/ TEETH COLOR: BLACK,SILDER/PULL COLOR: H6 ANTIQUE SILVER/ ZIPPER TAPE/ TEETH COLOR: BLACK,SILDER/PULL COLOR: X ANTIQUE COPPER/ ZIPPER TAPE/ TEETH COLOR: BLACK
4,4.0,12.0,zipper, #5 COIL ZIPPER  (SPECIAL HERRINGBONE TAPE),NON YKK / 1-WAY DADHR DIE CAST WIRE NON LOCKING,HAND POCKETS VERTICAL,1 PER SIDE = 2,SILDER/PULL COLOR: X ANTIQUE COPPER/ ZIPPER TAPE/ TEETH COLOR: 19-4010 TCX INK,SILDER/PULL COLOR: X ANTIQUE COPPER/ ZIPPER TAPE/ TEETH COLOR: 19-0515 TCX MILITARY,SILDER/PULL COLOR: H6 ANTIQUE SILVER/ ZIPPER TAPE/ TEETH COLOR: 19-1540 TCX RUST,SILDER/PULL COLOR: X ANTIQUE COPPER/ ZIPPER TAPE/ TEETH COLOR: 19-4006 TCX BLACK
5,5.0,13.0,zipper, #5 COIL ZIPPER,NON YKK / 1-WAY DADHR DIE CAST WIRE NON LOCKING,HAND POCKETS HORIZONTAL,1 PER SIDE = 2,SILDER/PULL COLOR: X ANTIQUE COPPER/ ZIPPER TAPE/ TEETH COLOR: BLACK,SILDER/PULL COLOR: X ANTIQUE COPPER/ ZIPPER TAPE/ TEETH COLOR: BLACK,SILDER/PULL COLOR: H6 ANTIQUE SILVER/ ZIPPER TAPE/ TEETH COLOR: BLACK,SILDER/PULL COLOR: X ANTIQUE COPPER/ ZIPPER TAPE/ TEETH COLOR: BLACK
6,6.0,14.0,zipper, #5 COIL ZIPPER,NON YKK / 1-WAY DADHR DIE CAST WIRE NON LOCKING,LINING POCKET VERTICAL,1,SILDER/PULL COLOR: X ANTIQUE COPPER/ ZIPPER TAPE/ TEETH COLOR: BLACK,SILDER/PULL COLOR: X ANTIQUE COPPER/ ZIPPER TAPE/ TEETH COLOR: BLACK,SILDER/PULL COLOR: H6 ANTIQUE SILVER/ ZIPPER TAPE/ TEETH COLOR: BLACK,SILDER/PULL COLOR: X ANTIQUE COPPER/ ZIPPER TAPE/ TEETH COLOR: BLACK
7,7.0,17.0,zipper,"L1-2018-TRIM-017
L1 Zipper Pull",YKK,CENTER FRONT,TOP AND BOTTOM PULL = 2,YKK X ANTIQUE COPPER,YKK X ANTIQUE COPPER,YKK H6 ANTIQUE SILVER,YKK X ANTIQUE COPPER
8,8.0,18.0,other,L1-2018-TRIM-018 / Non branded zipper pull Faux Leather ,PLEASE SOURCE: SAME SUPPLIER AS OTHER FAUX LEATHER TRIMS,RIGHT CHEST POCKET (1) HAND POCKETS (4),5,BROWN FAUX LEATHER,BROWN FAUX LEATHER,BROWN FAUX LEATHER,BROWN FAUX LEATHER
9,9.0,19.0,other, 11NT-045 / SELF FABRIC PULL ,FACTORY MADE,UNDERARM VENTS,1 PER SIDE = 2,MATCH TO SHELL,MATCH TO SHELL,MATCH TO SHELL,MATCH TO SHELL
10,10.0,20.0,other, 11NT-045 / SELF FABRIC PULL ,FACTORY MADE,LINING POCKET VERTICAL,1,MATCH TO SHELL,MATCH TO SHELL,MATCH TO SHELL,MATCH TO SHELL
11,11.0,23.0,other,"L1-2018-TRIM-010
Faux Leather backed Snap",LUKS,"CF PLACKET (4), POCKET FLAPS (4)",8,DOXCP DULL OXIDIZED COPPER/ BROWN FAUX LEATHER,DOXCP DULL OXIDIZED COPPER/ BROWN FAUX LEATHER,SAS54 PSEUDO ANTI SILVER/BROWN FAUX LEATHER,DOXCP DULL OXIDIZED COPPER/ BROWN FAUX LEATHER
12,12.0,24.0,other,"L1-2018-TRIM-004
Brown faux leather hem wrap",PLEASE SOURCE SUPPLIER,LEFT CHEST POCKET FLAP,1,BROWN FAUX LEATHER,BROWN FAUX LEATHER,BROWN FAUX LEATHER,BROWN FAUX LEATHER
13,13.0,25.0,other,"L1-2018-TRIM-003
Faux Leather patch ",PLEASE SOURCE SUPPLIER,RIGHT HAND POCKET,1,BROWN FAUX LEATHER,BROWN FAUX LEATHER,BROWN FAUX LEATHER,BROWN FAUX LEATHER
14,14.0,26.0,other,"L1-2018-TRIM-024/  L1 EMBROIDERY SMALL
3cm x 2.77cm  ",SOLUNA,LEFT SLEEVE HEM,1,MATCHING,MATCHING,MATCHING,MATCHING
15,15.0,30.0,interfacing,15MM METAL SNAP ,LUKS / 404,POWDER SKIRT - FRONT CLOSURE,"2 FEMALE, 4 MALE",AL023 ALLOY (D) CAP / DOXCP OXIDIZED COPPER BASE ,AL023 ALLOY (D) CAP / DOXCP OXIDIZED COPPER BASE ,AL023 ALLOY (D) CAP / SAS54 PSEUDO ANTI SILVER BASE,AL023 ALLOY (D) CAP / DOXCP OXIDIZED COPPER
16,16.0,31.0,interfacing,15MM METAL SNAP ,LUKS / 404,SNAP AWAY POWDER SKIRT - LINING FACING ,1 MALE 1 FEMALE,AL023 ALLOY (D) CAP / DOXCP OXIDIZED COPPER BASE ,AL023 ALLOY (D) CAP / DOXCP OXIDIZED COPPER BASE ,AL023 ALLOY (D) CAP / SAS54 PSEUDO ANTI SILVER BASE,AL023 ALLOY (D) CAP / DOXCP OXIDIZED COPPER
17,17.0,32.0,interfacing,15MM METAL SNAP ,LUKS / 404,POWDER SKIRT - JACKET TO PANT CONNECTION,3 SETS,AL023 ALLOY (D) CAP / DOXCP OXIDIZED COPPER BASE ,AL023 ALLOY (D) CAP / DOXCP OXIDIZED COPPER BASE ,AL023 ALLOY (D) CAP / SAS54 PSEUDO ANTI SILVER BASE,AL023 ALLOY (D) CAP / DOXCP OXIDIZED COPPER
18,18.0,33.0,other,METAL EYELETS 8MM ,LUKS / ET04,HOOD CORD EXIT FRONT,1 PER SIDE = 2 ,DOXCP OXIDIZED COPPER,DOXCP OXIDIZED COPPER,SAS54 PSEUDO ANTI SILVER,DOXCP OXIDIZED COPPER
19,19.0,34.0,other,METAL EYELETS 8MM ,LUKS / ET04,HEM CORD EXIT,2 PER SIDE = 4 ,DOXCP OXIDIZED COPPER,DOXCP OXIDIZED COPPER,SAS54 PSEUDO ANTI SILVER,DOXCP OXIDIZED COPPER
20,20.0,35.0,other,CORD LOCK: SMALL CORD LOCK WITH TIE DOWN,SUN SUN/ SV160824-2A,FRONT HOOD ADJUST,1 PER SIDE = 2,19-4010 TCX INK,19-0515 TCX MILITARY,19-1540 TCX RUST,19-4006 TCX BLACK
21,21.0,38.0,other,METAL DRAWCORD TIP,SEE PHOTO,HOOD SHOCKCORD TIPS,1 PER SIDE = 2,DOXCP OXIDIZED COPPER,DOXCP OXIDIZED COPPER,SAS54 PSEUDO ANTI SILVER,DOXCP OXIDIZED COPPER
22,22.0,39.0,other,KEYCLIP,AS LAST YEAR PRODUCTION,RIGHT HAND POCKET,1,BLACK,BLACK,BLACK,BLACK
23,23.0,42.0,other,"GROSGRAIN 1/4""",XXX,ATTACH FRONT HOOD CORD LOCK,1 PER SIDE = 2,BLACK,BLACK,BLACK,BLACK
24,24.0,43.0,other,"GROSGRAIN 3/8""",XXX,ATTACH HEM CORD LOCK,1 PER SIDE = 2,BLACK,BLACK,BLACK,BLACK
25,25.0,44.0,other,"GROSGRAIN 1/4""",XXX,ATTACH KEYCLIP RIGHT HAND POCKET ,1,BLACK,BLACK,BLACK,BLACK
26,26.0,45.0,other,"GROSGRAIN 3/4"" X  3 1/2"" FLAT WEBBING (FINISHED LENGTH)",,POWDER SKIRT - SIDE TABS JACKET TO PANT CONNECTION ,2,BLACK,BLACK,BLACK,BLACK
27,27.0,46.0,other,"SHELL FABRIC TAB  1"" X 1"" WRAP AROUND ",,JACKET TO PANT CONNECTION CENTER BACK ON TAB,1,MATCH TO SHELL,MATCH TO SHELL,MATCH TO SHELL,MATCH TO SHELL
28,28.0,47.0,other,"SHELL FABRIC TAB  1"" X 1"" WRAP AROUND ",,JACKET TO PANT CONNECTION CENTER BACK UNDER SNAP ON GRIPPER ELASTIC,1,MATCH TO SHELL,MATCH TO SHELL,MATCH TO SHELL,MATCH TO SHELL
29,29.0,48.0,other,"SHELL FABRIC TAB 3/4"" X  1"" ",,JACKET TO PANT CONNECTION AT SIDE TABS UNDER SNAPS,1 PER SIDE = 2,MATCH TO SHELL,MATCH TO SHELL,MATCH TO SHELL,MATCH TO SHELL
30,30.0,49.0,other,"ELASTIC 1"" X 4""",,POWDER SKIRT MIDDLE TAB - JACKET TO PANT CONNECTION ,1,BLACK,BLACK,BLACK,BLACK
31,31.0,50.0,insulation,ELASTIC ,,BACK OF SLEEVE CUFFS,1,AVAILABLE,AVAILABLE,AVAILABLE,AVAILABLE
32,32.0,51.0,other,"ELASTIC 1/4"" ",,MEDIA POCKET CORD HOLDER,1,BLACK,BLACK,BLACK,BLACK
33,33.0,52.0,other,GRIPPER ELASTIC 25mm NON LOGO,MTT0022,POWDER SKIRT HEM,1,BLACK,BLACK,BLACK,BLACK
34,34.0,53.0,other,ELASTINE BINDING,,GOGGLE POCKET BINDING,1,BLACK,BLACK,BLACK,BLACK
35,35.0,57.0,other," 1/2"" X 1 1/2"" VELCRO WITH ROUNDED CORNERS",PAIHO / Loop#1057 / HookETN7,CHIN,1,MATCH TO SHELL,MATCH TO SHELL,MATCH TO SHELL,MATCH TO SHELL
36,36.0,58.0,other," 1/2"" X 3 VELCRO WITH ROUNDED CORNERS",PAIHO / Loop#1057 / HookETN7,CENTER FRONT PLACKET,4,MATCH TO SHELL,MATCH TO SHELL,MATCH TO SHELL,MATCH TO SHELL
37,37.0,59.0,other,"1/2"" X 1 1/2"" VELCRO WITH ROUNDED CORNERS",PAIHO / Loop#1057 / HookETN7,LEFT CHEST POCKET FLAPS,2,MATCH TO SHELL,MATCH TO SHELL,MATCH TO SHELL,MATCH TO SHELL
38,38.0,60.0,other,"1/2"" X 1 1/2"" VELCRO WITH ROUNDED CORNERS",PAIHO / Loop#1057 / HookETN7,RIGHT POCKET FLAPS,1,MATCH TO SHELL,MATCH TO SHELL,MATCH TO SHELL,MATCH TO SHELL
39,39.0,61.0,other,"1/2"" X 2"" VELCRO WITH ROUNDED CORNERS",PAIHO / Loop#1057 / HookETN7,HAND POCKET FLAPS,2,MATCH TO SHELL,MATCH TO SHELL,MATCH TO SHELL,MATCH TO SHELL
40,40.0,62.0,other,"1"" X 3 3/4"" VELCRO WITH ROUNDED CORNERS",PAIHO / Loop#1057,CUFF ON BODY,1 PER SIDE = 2,MATCH TO SHELL,MATCH TO SHELL,MATCH TO SHELL,MATCH TO SHELL
41,41.0,63.0,other,"1"" X 2 1/2"" VELCRO WITH ROUNDED CORNERS",PAIHO / HookETN7,CUFF ON TAB,1 PER SIDE = 2,MATCH TO SHELL,MATCH TO SHELL,MATCH TO SHELL,MATCH TO SHELL
42,42.0,66.0,other,SEAMS,10-12 SPI,30/2,,MATCH TO SHELL,MATCH TO SHELL,MATCH TO SHELL,MATCH TO SHELL
43,43.0,67.0,other,TOPSTITCH,8-10 SPI,30/2,,MATCH TO SHELL,MATCH TO SHELL,MATCH TO SHELL,MATCH TO SHELL
44,44.0,68.0,other,BARTACKS,,100/2,,MATCH TO SHELL,MATCH TO SHELL,MATCH TO SHELL,MATCH TO SHELL
45,45.0,69.0,other,SLEEVE GAITER COVER STITCH,MUST BE STRETCH THREAD,,,MATCH TO SHELL,MATCH TO SHELL,MATCH TO SHELL,MATCH TO SHELL
46,46.0,72.0,label,15K/15K FULLY TAPED,SOLUNA/ MAIN LABEL,CENTER BACK BELOW NECK SEAM,1,15K/15K FULLY TAPED,,,
47,47.0,73.0,label,SIZE LABEL (SAMPLE SIZE L),SOLUNA/ SIZE LABEL,CENTER BACK BELOW MAIN LABEL,1,"XS, S, M, L, XL",,,
48,48.0,76.0,other,MENS JACKET HANG TAG,SOLUNA/ MENS JACKET HANG TAG,LEFT SIDE HAND POCKET ZIPPER,1,MENS JACKET HANG TAG,,,
49,49.0,80.0,label,ADDRESS LABEL,FACTORY SOURCED,LINING LEFT SIDE SEAM,1,ADDRESS LABEL,,,
50,50.0,81.0,label,CONTENT LABEL,FACTORY SOURCED,LINING LEFT SIDE SEAM,1,CONTENT LABEL,,,
51,51.0,82.0,label,WASHING LABEL,FACTORY SOURCED,LINING LEFT SIDE SEAM,1,WASHING LABEL,,,
